{
  "slug": "gmk-cyl-ramune",
  "name": "GMK CYL Ramune",
  "vendorSlug": "kbdfans",
  "profile": "cherry",
  "material": "abs",
  "legendType": "doubleshot",
  "designer": null,
  "releasedAt": null,
  "status": "sold-out",
  "description": "Pastel dual-blue and pink doubleshot ABS Cherry-profile set in GMK's CYL cylindrical sub-line — the first CYL run to adopt a J-influenced palette (sky-blue primary, lighter secondary blue, blush-pink accent over a WS1-white base), named after Japanese Ramune soda. Also the first CYL set distributed across ten simultaneous regional storefronts (Divinikey US, Prototypist UK, Geonworks KR, Yushakobo JP, and six others) rather than a single KBDfans-hosted window. Group buy ran 2026-05-15 through 2026-06-20; Q3/Q4 2026 fulfillment via GMK Germany.",
  "updatedAt": "2026-07-08T00:00:00.000Z"
}
