{
  "slug": "gmk-olivia",
  "name": "GMK Olivia",
  "vendorSlug": "cannonkeys",
  "profile": "cherry",
  "material": "abs",
  "legendType": "doubleshot",
  "designer": "Olivia",
  "releasedAt": "2018-04-01",
  "status": "discontinued",
  "description": "Soft pink-and-cream Cherry-profile set with black accents. Designed by Olivia and produced by GMK. Often cited as the set that proved a non-traditional palette could anchor a community-favorite design.",
  "updatedAt": "2026-05-08T00:00:00.000Z"
}
