{
  "slug": "mt3-dasher",
  "name": "Drop MT3 Dasher",
  "vendorSlug": "drop",
  "profile": "mt3",
  "material": "abs",
  "legendType": "doubleshot",
  "designer": "MiTo",
  "releasedAt": "2021-03-01",
  "status": "in-stock",
  "description": "Tall, scooped MT3-profile doubleshot ABS set in two-tone blue, inspired by the Data General Dasher terminal. One of the longest-running MT3 sets at Drop and a common pick for vintage-leaning builds.",
  "updatedAt": "2026-05-09T20:00:00.000Z"
}
