{
  "slug": "domikey-wob",
  "name": "Domikey WOB",
  "vendorSlug": "kbdfans",
  "profile": "cherry",
  "material": "pbt",
  "legendType": "doubleshot",
  "designer": null,
  "releasedAt": "2020-01-01",
  "status": "in-stock",
  "description": "Evergreen white-on-black Cherry-profile PBT doubleshot set from Domikey. Praised for tight legend registration and minimal shine over extended use — the PBT material resists the greasy sheen that plagues ABS sets. A benchmark utility set for builders who want a clean, functional look without the group-buy wait or aftermarket premium.",
  "updatedAt": "2026-05-21T00:00:00.000Z"
}
